{
  "$schema": "https://json-schema.org/draft/2020-12/schema",
  "$id": "https://ninjatomapps.com/site-manifest.schema.json",
  "title": "NinjaTom Project Site Manifest",
  "description": "Metadata used by the NinjaTom Apps master site to render a project card.",
  "type": "object",
  "additionalProperties": false,
  "properties": {
    "name": {
      "type": "string",
      "minLength": 1,
      "description": "Public app or project name."
    },
    "tagline": {
      "type": "string",
      "description": "Short one-sentence summary shown on the project card."
    },
    "category": {
      "type": "string",
      "description": "Display category, for example iOS App, Web App, Game, Tool, or Creative / Custom3D."
    },
    "status": {
      "type": "string",
      "description": "Legacy product-status badge. Prefer productStatus for new manifests."
    },
    "productStatus": {
      "type": "string",
      "enum": [
        "Shipped / Available",
        "Released but actively maintained",
        "Near Release / Release Candidate",
        "Active Development",
        "Prototype / Concept Lab",
        "Internal Developer Tool",
        "Planned / On Hold",
        "Archived / Superseded",
        "Exclude from Public Portfolio"
      ],
      "description": "Actual product lifecycle status, separate from whether a website is reachable."
    },
    "websiteStatus": {
      "type": "string",
      "description": "Public website availability, for example Public project site available, Public staging site available, or NinjaTomApps portfolio detail."
    },
    "website": {
      "type": "string",
      "format": "uri",
      "description": "Primary public website URL."
    },
    "supportUrl": {
      "oneOf": [
        {
          "type": "string",
          "format": "uri"
        },
        {
          "const": ""
        }
      ],
      "description": "Support page URL."
    },
    "privacyUrl": {
      "oneOf": [
        {
          "type": "string",
          "format": "uri"
        },
        {
          "const": ""
        }
      ],
      "description": "Privacy policy URL."
    },
    "appStoreUrl": {
      "oneOf": [
        {
          "type": "string",
          "format": "uri"
        },
        {
          "const": ""
        }
      ],
      "description": "App Store URL, when available."
    },
    "icon": {
      "oneOf": [
        {
          "type": "string",
          "format": "uri"
        },
        {
          "const": ""
        }
      ],
      "description": "Absolute URL for an app icon or project mark."
    },
    "previewImage": {
      "oneOf": [
        {
          "type": "string",
          "format": "uri"
        },
        {
          "const": ""
        }
      ],
      "description": "Optional absolute URL for a card preview image or screenshot."
    },
    "previewImageAlt": {
      "type": "string",
      "description": "Accessible alt text for the preview image."
    },
    "screenshots": {
      "type": "array",
      "description": "Optional screenshots displayed in the master site's project detail drawer.",
      "items": {
        "oneOf": [
          {
            "type": "string",
            "format": "uri"
          },
          {
            "type": "object",
            "additionalProperties": false,
            "properties": {
              "src": {
                "type": "string",
                "format": "uri",
                "description": "Absolute screenshot image URL."
              },
              "alt": {
                "type": "string",
                "description": "Accessible alt text for the screenshot."
              },
              "caption": {
                "type": "string",
                "description": "Short visible caption shown below the screenshot."
              }
            },
            "required": ["src"]
          }
        ]
      }
    },
    "launchedAt": {
      "type": "string",
      "format": "date-time",
      "description": "Optional launch date used for Recently Launched filtering and RSS metadata."
    },
    "launchDate": {
      "type": "string",
      "format": "date-time",
      "description": "Alias for launchedAt."
    },
    "version": {
      "type": "string",
      "description": "Optional public version or launch label shown in the project detail drawer."
    },
    "launchNotes": {
      "type": "string",
      "description": "Optional launch or release note shown in the project detail drawer and RSS feed."
    },
    "versionHighlights": {
      "type": "array",
      "description": "Optional short highlights shown under launch notes in the project detail drawer.",
      "items": {
        "type": "string"
      }
    },
    "projectedReleaseDate": {
      "type": "string",
      "format": "date-time",
      "description": "Optional manual projected App Store or public release date. Used only when appStoreUrl is blank."
    },
    "estimatedReleaseDate": {
      "type": "string",
      "format": "date-time",
      "description": "Alias for projectedReleaseDate."
    },
    "targetReleaseDate": {
      "type": "string",
      "format": "date-time",
      "description": "Alias for projectedReleaseDate."
    },
    "progressPercent": {
      "type": "number",
      "minimum": 0,
      "maximum": 100,
      "description": "Optional owner-curated release-progress value from 0 to 100. No progress is inferred when omitted."
    },
    "progress": {
      "type": "number",
      "minimum": 0,
      "maximum": 100,
      "description": "Alias for progressPercent."
    },
    "completionPercent": {
      "type": "number",
      "minimum": 0,
      "maximum": 100,
      "description": "Alias for progressPercent."
    },
    "releaseProjectionNote": {
      "type": "string",
      "description": "Optional note shown in the release projection drawer section."
    },
    "progressNote": {
      "type": "string",
      "description": "Alias for releaseProjectionNote."
    },
    "accent": {
      "type": "string",
      "pattern": "^#[0-9A-Fa-f]{6}$",
      "description": "Six-digit hex accent color for the card."
    },
    "featured": {
      "type": "boolean",
      "description": "Featured projects are sorted before non-featured projects."
    },
    "sortOrder": {
      "type": "number",
      "description": "Lower numbers appear first within the featured/non-featured group."
    }
  },
  "required": ["name", "tagline", "category", "website"],
  "anyOf": [
    { "required": ["productStatus"] },
    { "required": ["status"] }
  ],
  "examples": [
    {
      "name": "DoorCodes",
      "tagline": "Access codes, ready on arrival with privacy-safe reminders and Secure Reveal.",
      "category": "Mobile App",
      "productStatus": "Shipped / Available",
      "websiteStatus": "Public website and App Store available",
      "website": "https://doorcodesapp.com/",
      "supportUrl": "https://doorcodesapp.com/support.html",
      "privacyUrl": "https://doorcodesapp.com/privacy.html",
      "appStoreUrl": "https://apps.apple.com/us/app/doorcodes-vault/id6761863570",
      "icon": "https://doorcodesapp.com/assets/doorcodes-favicon-512.png",
      "previewImage": "https://doorcodesapp.com/assets/doorcodes-social-preview.png",
      "previewImageAlt": "DoorCodes website preview for the upgraded access-code app site.",
      "screenshots": [
        {
          "src": "https://doorcodesapp.com/assets/doorcodes-social-preview.png",
          "alt": "DoorCodes social preview artwork with the app icon and access-code imagery.",
          "caption": "Launch preview"
        }
      ],
      "launchedAt": "2026-04-13T00:00:00Z",
      "version": "1.0.3",
      "launchNotes": "DoorCodes is live with App Store, support, privacy, and launch artwork connected.",
      "versionHighlights": [
        "App Store listing connected",
        "Support and privacy pages available",
        "Premium screenshot gallery ready"
      ],
      "accent": "#38BDF8",
      "featured": true,
      "sortOrder": 10
    }
  ]
}
