{
  "name": "DoorCodes",
  "tagline": "Access codes, ready on arrival with privacy-safe reminders and Secure Reveal.",
  "category": "iOS App",
  "status": "Shipped / Available",
  "website": "https://doorcodesapp.com/",
  "supportUrl": "https://doorcodesapp.com/support.html",
  "privacyUrl": "https://doorcodesapp.com/privacy.html",
  "appStoreUrl": "https://apps.apple.com/us/app/doorcodes-vault/id6761863570",
  "icon": "https://doorcodesapp.com/assets/doorcodes-favicon-512.png",
  "previewImage": "https://doorcodesapp.com/assets/doorcodes-social-preview.png",
  "previewImageAlt": "DoorCodes website preview for the upgraded access-code app site.",
  "screenshots": [
    {
      "src": "https://doorcodesapp.com/assets/doorcodes-social-preview.png",
      "alt": "DoorCodes social preview artwork with the app icon and access-code imagery.",
      "caption": "Launch preview"
    }
  ],
  "version": "1.0.3",
  "launchNotes": "DoorCodes is shipped with a verified App Store listing, public support and privacy pages, and launch artwork.",
  "versionHighlights": [
    "App Store listing connected",
    "Support and privacy pages available",
    "Premium screenshot gallery ready"
  ],
  "accent": "#38BDF8",
  "featured": true,
  "sortOrder": 10,
  "productStatus": "Shipped / Available",
  "websiteStatus": "Public product site available"
}
