{
  "name": "FlowGuru",
  "tagline": "Creative flow tools and focus systems for getting unstuck.",
  "category": "Tool",
  "status": "Active Development",
  "website": "https://ninjatomonline.github.io/flowguru-site/",
  "supportUrl": "https://ninjatomonline.github.io/flowguru-site/support.html",
  "privacyUrl": "https://ninjatomonline.github.io/flowguru-site/privacy.html",
  "appStoreUrl": "",
  "icon": "",
  "screenshots": [
    {
      "src": "https://raw.githubusercontent.com/NinjaTomOnline/flowguru-site/main/assets/flowguru-preview.svg",
      "alt": "FlowGuru project preview artwork.",
      "caption": "Project preview"
    }
  ],
  "version": "Preview",
  "launchNotes": "FlowGuru is in active development with a public staging site.",
  "versionHighlights": [
    "Project preview connected",
    "Support and privacy URLs documented"
  ],
  "accent": "#FFCF70",
  "featured": false,
  "sortOrder": 50,
  "productStatus": "Active Development",
  "websiteStatus": "Public staging site available"
}
