{
  "name": "Zen Wisdom",
  "tagline": "Quiet daily reflections designed for calmer routines.",
  "category": "iOS App",
  "status": "Released but actively maintained",
  "website": "https://zenwisdom.app/",
  "supportUrl": "https://zenwisdom.app/support.html",
  "privacyUrl": "https://zenwisdom.app/privacy.html",
  "appStoreUrl": "https://apps.apple.com/us/app/zen-wisdom/id414329570",
  "icon": "https://zenwisdom.app/assets/icon-512.png",
  "previewImage": "https://zenwisdom.app/screenshots/zenwisdom-social-card.png",
  "previewImageAlt": "Zen Wisdom social preview with the app icon, feature highlights, and an iPhone home screenshot.",
  "screenshots": [
    {
      "src": "https://zenwisdom.app/screenshots/zenwisdom-social-card.png",
      "alt": "Zen Wisdom social preview with the app icon, feature highlights, and an iPhone home screenshot.",
      "caption": "Launch preview"
    }
  ],
  "version": "2.07",
  "launchNotes": "Zen Wisdom is a released and maintained reflection app with a verified App Store listing.",
  "versionHighlights": [
    "Daily reflections positioned",
    "Screenshot gallery available"
  ],
  "accent": "#A78BFA",
  "featured": false,
  "sortOrder": 30,
  "productStatus": "Released but actively maintained",
  "websiteStatus": "Public product site available"
}
