{
  "name": "SwiftTerm",
  "tagline": "A polished terminal companion for fast command notes and workflows.",
  "category": "Tool",
  "status": "Near Release / Release Candidate",
  "website": "https://swiftterm.app/",
  "supportUrl": "https://swiftterm.app/support.html",
  "privacyUrl": "https://swiftterm.app/privacy.html",
  "appStoreUrl": "",
  "icon": "",
  "screenshots": [
    {
      "src": "https://swiftterm.app/screenshots/social-card.png",
      "alt": "SwiftTerm project preview artwork.",
      "caption": "Project preview"
    }
  ],
  "version": "Preview",
  "launchNotes": "SwiftTerm has a public product site and remains a near-release preview candidate.",
  "versionHighlights": [
    "Project site indexed",
    "Technical preview artwork available"
  ],
  "accent": "#59F2C7",
  "featured": false,
  "sortOrder": 20,
  "productStatus": "Near Release / Release Candidate",
  "websiteStatus": "Public product site available"
}
