{
  "name": "Don't Speed",
  "tagline": "A speed-awareness app website built for simple, focused driving safety.",
  "category": "iOS App",
  "status": "Near Release / Release Candidate",
  "website": "https://dontspeed.app/",
  "supportUrl": "https://dontspeed.app/support.html",
  "privacyUrl": "https://dontspeed.app/privacy.html",
  "appStoreUrl": "",
  "icon": "https://dontspeed.app/screenshots/app-icon.png",
  "previewImage": "https://dontspeed.app/screenshots/social-card.png",
  "previewImageAlt": "Don't Speed social preview artwork.",
  "screenshots": [
    {
      "src": "https://dontspeed.app/screenshots/social-card.png",
      "alt": "Don't Speed social preview artwork.",
      "caption": "Launch preview"
    }
  ],
  "version": "TestFlight",
  "launchNotes": "Don’t Speed has a public product site and remains a near-release TestFlight candidate.",
  "versionHighlights": [
    "Driving safety message refined",
    "Support and privacy pages available"
  ],
  "accent": "#FF6FA8",
  "featured": false,
  "sortOrder": 40,
  "productStatus": "Near Release / Release Candidate",
  "websiteStatus": "Public product site available"
}
